{
  "$schema": "../wallet.schema.json",
  "wallet_name": "keplrextension",
  "pretty_name": "Keplr Wallet (Browser Extension)",
  "website": "https://www.keplr.app/",
  "platforms": [
    "browser_extension"
  ],
  "has_suggest_feature": true,
  "supported_chains": [
    "cosmoshub",
    "osmosis"
  ]
}
